<?xml version="1.0" encoding="UTF-8"?><!-- Listing 6.24 valid address since it refers to <internationaladdress> element which uses concrete datatype--><addr:internationaladdress addr:language="us-en" addr:countrycode="ban" xmlns:addr="http://www.nyu.edu/jws/Address" xmlns:xsi="http://www.w3.org/2001/XMLSchema-instance" xsi:schemaLocation="http://www.nyu.edu/jws/Address ../6.23/Address.xsd">	<addr:name>John Smith</addr:name>	<addr:street>16 Mirpur Road</addr:street>	<addr:street>Shamoli</addr:street>	<addr:apartment>2B</addr:apartment>	<addr:city>Dhaka</addr:city>	<addr:state></addr:state>	<addr:zip></addr:zip>	<addr:country>Bangladesh</addr:country></addr:internationaladdress>